
Current register/bus values :
-------------------------------------
Instruction Count : 20
PC                : 0x00400058
Registers:
R0: 0x00000000
R1: 0x00000000
R2: 0x0000000a
R3: 0x00000001
R4: 0xffffffff
R5: 0x0040134a
R6: 0x00000000
R7: 0x00000000
R8: 0x00000000
R9: 0x00000000
R10: 0x00000000
R11: 0x00000000
R12: 0x00000000
R13: 0x00000000
R14: 0x00000000
R15: 0x00000000
R16: 0x00000000
R17: 0x00000000
R18: 0x00000000
R19: 0x00000000
R20: 0x00000000
R21: 0x00000000
R22: 0x00000000
R23: 0x00000000
R24: 0x00000000
R25: 0x00000000
R26: 0x00000000
R27: 0x00000000
R28: 0x00000000
R29: 0x00000000
R30: 0x00000000
R31: 0x00400024
HI: 0x00000000
LO: 0x00000000


Current register/bus values :
-------------------------------------
Instruction Count : 21
PC                : 0x0040005c
Registers:
R0: 0x00000000
R1: 0x00000000
R2: 0x0000000a
R3: 0x00000001
R4: 0xffffffff
R5: 0x00401421
R6: 0x00000000
R7: 0x00000000
R8: 0x00000000
R9: 0x00000000
R10: 0x00000000
R11: 0x00000000
R12: 0x00000000
R13: 0x00000000
R14: 0x00000000
R15: 0x00000000
R16: 0x00000000
R17: 0x00000000
R18: 0x00000000
R19: 0x00000000
R20: 0x00000000
R21: 0x00000000
R22: 0x00000000
R23: 0x00000000
R24: 0x00000000
R25: 0x00000000
R26: 0x00000000
R27: 0x00000000
R28: 0x00000000
R29: 0x00000000
R30: 0x00000000
R31: 0x00400024
HI: 0x00000000
LO: 0x00000000


Current register/bus values :
-------------------------------------
Instruction Count : 22
PC                : 0x00400068
Registers:
R0: 0x00000000
R1: 0x00000000
R2: 0x0000000a
R3: 0x00000001
R4: 0xffffffff
R5: 0x00401421
R6: 0x00000000
R7: 0x00000000
R8: 0x00000000
R9: 0x00000000
R10: 0x00000000
R11: 0x00000000
R12: 0x00000000
R13: 0x00000000
R14: 0x00000000
R15: 0x00000000
R16: 0x00000000
R17: 0x00000000
R18: 0x00000000
R19: 0x00000000
R20: 0x00000000
R21: 0x00000000
R22: 0x00000000
R23: 0x00000000
R24: 0x00000000
R25: 0x00000000
R26: 0x00000000
R27: 0x00000000
R28: 0x00000000
R29: 0x00000000
R30: 0x00000000
R31: 0x00400060
HI: 0x00000000
LO: 0x00000000


Current register/bus values :
-------------------------------------
Instruction Count : 23
PC                : 0x0040006c
Registers:
R0: 0x00000000
R1: 0x00000000
R2: 0x0000000a
R3: 0x00000001
R4: 0xffffffff
R5: 0x00401421
R6: 0x00000000
R7: 0x00000000
R8: 0x00000000
R9: 0x00000000
R10: 0x00000000
R11: 0x00000000
R12: 0x00000000
R13: 0x00000000
R14: 0x00000000
R15: 0x00000000
R16: 0x00000000
R17: 0x00000000
R18: 0x00000000
R19: 0x00000000
R20: 0x00000000
R21: 0x00000000
R22: 0x00000000
R23: 0x00000000
R24: 0x00000000
R25: 0x00000000
R26: 0x00000000
R27: 0x00000000
R28: 0x00000000
R29: 0x00000000
R30: 0x00000000
R31: 0x00400060
HI: 0x00000000
LO: 0x00000000


Current register/bus values :
-------------------------------------
Instruction Count : 24
PC                : 0x00400078
Registers:
R0: 0x00000000
R1: 0x00000000
R2: 0x0000000a
R3: 0x00000001
R4: 0xffffffff
R5: 0x00401421
R6: 0x00000000
R7: 0x00000000
R8: 0x00000000
R9: 0x00000000
R10: 0x00000000
R11: 0x00000000
R12: 0x00000000
R13: 0x00000000
R14: 0x00000000
R15: 0x00000000
R16: 0x00000000
R17: 0x00000000
R18: 0x00000000
R19: 0x00000000
R20: 0x00000000
R21: 0x00000000
R22: 0x00000000
R23: 0x00000000
R24: 0x00000000
R25: 0x00000000
R26: 0x00000000
R27: 0x00000000
R28: 0x00000000
R29: 0x00000000
R30: 0x00000000
R31: 0x00400070
HI: 0x00000000
LO: 0x00000000


Current register/bus values :
-------------------------------------
Instruction Count : 25
PC                : 0x0040007c
Registers:
R0: 0x00000000
R1: 0x00000000
R2: 0x0000000a
R3: 0x00000001
R4: 0xffffffff
R5: 0x00401421
R6: 0x00000000
R7: 0x00000000
R8: 0x00000000
R9: 0x00000000
R10: 0x00000000
R11: 0x00000000
R12: 0x00000000
R13: 0x00000000
R14: 0x00000000
R15: 0x00000000
R16: 0x00000000
R17: 0x00000000
R18: 0x00000000
R19: 0x00000000
R20: 0x00000000
R21: 0x00000000
R22: 0x00000000
R23: 0x00000000
R24: 0x00000000
R25: 0x00000000
R26: 0x00000000
R27: 0x00000000
R28: 0x00000000
R29: 0x00000000
R30: 0x00000000
R31: 0x00400070
HI: 0x00000000
LO: 0x00000000


Current register/bus values :
-------------------------------------
Instruction Count : 26
PC                : 0x00400080
Registers:
R0: 0x00000000
R1: 0x00000000
R2: 0x0000000a
R3: 0x00000001
R4: 0xffffffff
R5: 0x00401421
R6: 0x00000000
R7: 0x00000000
R8: 0x00000000
R9: 0x00000000
R10: 0x00000000
R11: 0x00000000
R12: 0x00000000
R13: 0x00000000
R14: 0x00000000
R15: 0x00000000
R16: 0x00000000
R17: 0x00000000
R18: 0x00000000
R19: 0x00000000
R20: 0x00000000
R21: 0x00000000
R22: 0x00000000
R23: 0x00000000
R24: 0x00000000
R25: 0x00000000
R26: 0x00000000
R27: 0x00000000
R28: 0x00000000
R29: 0x00000000
R30: 0x00000000
R31: 0x00400070
HI: 0x00000000
LO: 0x00000000


Current register/bus values :
-------------------------------------
Instruction Count : 27
PC                : 0x00400084
Registers:
R0: 0x00000000
R1: 0xbeb00000
R2: 0x0000000a
R3: 0x00000001
R4: 0xffffffff
R5: 0x00401421
R6: 0x00000000
R7: 0x00000000
R8: 0x00000000
R9: 0x00000000
R10: 0x00000000
R11: 0x00000000
R12: 0x00000000
R13: 0x00000000
R14: 0x00000000
R15: 0x00000000
R16: 0x00000000
R17: 0x00000000
R18: 0x00000000
R19: 0x00000000
R20: 0x00000000
R21: 0x00000000
R22: 0x00000000
R23: 0x00000000
R24: 0x00000000
R25: 0x00000000
R26: 0x00000000
R27: 0x00000000
R28: 0x00000000
R29: 0x00000000
R30: 0x00000000
R31: 0x00400070
HI: 0x00000000
LO: 0x00000000


Current register/bus values :
-------------------------------------
Instruction Count : 28
PC                : 0x00400088
Registers:
R0: 0x00000000
R1: 0xbeb0063d
R2: 0x0000000a
R3: 0x00000001
R4: 0xffffffff
R5: 0x00401421
R6: 0x00000000
R7: 0x00000000
R8: 0x00000000
R9: 0x00000000
R10: 0x00000000
R11: 0x00000000
R12: 0x00000000
R13: 0x00000000
R14: 0x00000000
R15: 0x00000000
R16: 0x00000000
R17: 0x00000000
R18: 0x00000000
R19: 0x00000000
R20: 0x00000000
R21: 0x00000000
R22: 0x00000000
R23: 0x00000000
R24: 0x00000000
R25: 0x00000000
R26: 0x00000000
R27: 0x00000000
R28: 0x00000000
R29: 0x00000000
R30: 0x00000000
R31: 0x00400070
HI: 0x00000000
LO: 0x00000000


Current register/bus values :
-------------------------------------
Instruction Count : 29
PC                : 0x0040008c
Registers:
R0: 0x00000000
R1: 0xbeb0063d
R2: 0x0000000a
R3: 0x00000001
R4: 0xffffffff
R5: 0xbef01a5e
R6: 0x00000000
R7: 0x00000000
R8: 0x00000000
R9: 0x00000000
R10: 0x00000000
R11: 0x00000000
R12: 0x00000000
R13: 0x00000000
R14: 0x00000000
R15: 0x00000000
R16: 0x00000000
R17: 0x00000000
R18: 0x00000000
R19: 0x00000000
R20: 0x00000000
R21: 0x00000000
R22: 0x00000000
R23: 0x00000000
R24: 0x00000000
R25: 0x00000000
R26: 0x00000000
R27: 0x00000000
R28: 0x00000000
R29: 0x00000000
R30: 0x00000000
R31: 0x00400070
HI: 0x00000000
LO: 0x00000000


Current register/bus values :
-------------------------------------
Instruction Count : 30
PC                : 0x00400090
Registers:
R0: 0x00000000
R1: 0xbeb0063d
R2: 0x0000000a
R3: 0x00000001
R4: 0xffffffff
R5: 0xbef01a5e
R6: 0x00000000
R7: 0x00000000
R8: 0x00000000
R9: 0x00000000
R10: 0x00000000
R11: 0x00000000
R12: 0x00000000
R13: 0x00000000
R14: 0x00000000
R15: 0x00000000
R16: 0x00000000
R17: 0x00000000
R18: 0x00000000
R19: 0x00000000
R20: 0x00000000
R21: 0x00000000
R22: 0x00000000
R23: 0x00000000
R24: 0x00000000
R25: 0x00000000
R26: 0x00000000
R27: 0x00000000
R28: 0x00000000
R29: 0x00000000
R30: 0x00000000
R31: 0x00400070
HI: 0x00000000
LO: 0x00000000

